{
  "_format": "agenttool.deepseek-source-catalog/0.1",
  "catalog_version": "2026-08-01",
  "observed_on": "2026-08-01",
  "sources": [
    {
      "source_id": "deepgemm-github",
      "title": "DeepGEMM official repository README",
      "origin": "deepseek_github",
      "resource_kind": "code_repository",
      "repository_id": "deepseek-ai/DeepGEMM",
      "revision": "559d79fb6994a58b8a15b4b93bf13ccc16edf247",
      "path": "README.md",
      "evidence_sha256": "sha256:df82e7d6979e49e864cd0c8b2389648ebfa226b9f4b331646d7d5cdc4951ee63",
      "canonical_url": "https://github.com/deepseek-ai/DeepGEMM/blob/559d79fb6994a58b8a15b4b93bf13ccc16edf247/README.md",
      "evidence_url": "https://raw.githubusercontent.com/deepseek-ai/DeepGEMM/559d79fb6994a58b8a15b4b93bf13ccc16edf247/README.md",
      "candidate_lanes": ["training_systems"],
      "classification_basis": "researcher_inference_from_primary_source",
      "license_review_required": true
    },
    {
      "source_id": "deepseek-math-paper",
      "title": "DeepSeekMath primary paper",
      "origin": "arxiv_primary",
      "resource_kind": "paper",
      "repository_id": "2402.03300",
      "revision": "2402.03300v3",
      "path": null,
      "evidence_sha256": "sha256:6cc20b3c5b8d25b8b53868fc4ec1792c144f07d67bdf7395138efd4422197e7b",
      "canonical_url": "https://arxiv.org/abs/2402.03300v3",
      "evidence_url": "https://arxiv.org/pdf/2402.03300v3",
      "candidate_lanes": ["evaluation", "reasoning"],
      "classification_basis": "researcher_inference_from_primary_source",
      "license_review_required": true
    },
    {
      "source_id": "deepseek-math-v2-github",
      "title": "DeepSeekMath-V2 official repository README",
      "origin": "deepseek_github",
      "resource_kind": "code_repository",
      "repository_id": "deepseek-ai/DeepSeek-Math-V2",
      "revision": "665c840782baf7faae8a8b244ea313f3cfcc346f",
      "path": "README.md",
      "evidence_sha256": "sha256:2791088220ea492c42c8b9fbf0004757123745ed43dcb4356c7e274740ab2c4e",
      "canonical_url": "https://github.com/deepseek-ai/DeepSeek-Math-V2/blob/665c840782baf7faae8a8b244ea313f3cfcc346f/README.md",
      "evidence_url": "https://raw.githubusercontent.com/deepseek-ai/DeepSeek-Math-V2/665c840782baf7faae8a8b244ea313f3cfcc346f/README.md",
      "candidate_lanes": ["evaluation", "formal_verification", "reasoning"],
      "classification_basis": "researcher_inference_from_primary_source",
      "license_review_required": true
    },
    {
      "source_id": "deepseek-math-v2-hf-model",
      "title": "DeepSeekMath-V2 official Hugging Face model card",
      "origin": "deepseek_huggingface",
      "resource_kind": "model_repository",
      "repository_id": "deepseek-ai/DeepSeek-Math-V2",
      "revision": "6ea7c60b42df79beac8cfa51ccb7e19b9e7b6e95",
      "path": "README.md",
      "evidence_sha256": "sha256:80a3fb436883c9f7ba659eae2dd50fb42c5a387f06fcded088a7fb805e93071d",
      "canonical_url": "https://huggingface.co/deepseek-ai/DeepSeek-Math-V2/blob/6ea7c60b42df79beac8cfa51ccb7e19b9e7b6e95/README.md",
      "evidence_url": "https://huggingface.co/deepseek-ai/DeepSeek-Math-V2/resolve/6ea7c60b42df79beac8cfa51ccb7e19b9e7b6e95/README.md",
      "candidate_lanes": ["formal_verification", "research_provenance"],
      "classification_basis": "researcher_inference_from_primary_source",
      "license_review_required": true
    },
    {
      "source_id": "deepseek-prover-v2-github",
      "title": "DeepSeek-Prover-V2 official repository README",
      "origin": "deepseek_github",
      "resource_kind": "code_repository",
      "repository_id": "deepseek-ai/DeepSeek-Prover-V2",
      "revision": "e598a57ea3284997d4a2a168a069fdd5064afbc8",
      "path": "README.md",
      "evidence_sha256": "sha256:08d0b515c693c84d2aca9160efe72e15405f85d8990c547f7a779a555753fb54",
      "canonical_url": "https://github.com/deepseek-ai/DeepSeek-Prover-V2/blob/e598a57ea3284997d4a2a168a069fdd5064afbc8/README.md",
      "evidence_url": "https://raw.githubusercontent.com/deepseek-ai/DeepSeek-Prover-V2/e598a57ea3284997d4a2a168a069fdd5064afbc8/README.md",
      "candidate_lanes": ["evaluation", "formal_verification"],
      "classification_basis": "researcher_inference_from_primary_source",
      "license_review_required": true
    },
    {
      "source_id": "deepseek-proverbench-hf-dataset",
      "title": "DeepSeek-ProverBench official Hugging Face dataset card",
      "origin": "deepseek_huggingface",
      "resource_kind": "dataset_repository",
      "repository_id": "deepseek-ai/DeepSeek-ProverBench",
      "revision": "3b9f067088e5e005fab91434ddc05a903e0a6252",
      "path": "README.md",
      "evidence_sha256": "sha256:9b401b7ddeba804aa7595c4a4bc44ebc3b5865e8f76ac47b3938a30624ed1e21",
      "canonical_url": "https://huggingface.co/datasets/deepseek-ai/DeepSeek-ProverBench/blob/3b9f067088e5e005fab91434ddc05a903e0a6252/README.md",
      "evidence_url": "https://huggingface.co/datasets/deepseek-ai/DeepSeek-ProverBench/resolve/3b9f067088e5e005fab91434ddc05a903e0a6252/README.md",
      "candidate_lanes": ["evaluation", "formal_verification", "research_provenance"],
      "classification_basis": "researcher_inference_from_primary_source",
      "license_review_required": true
    },
    {
      "source_id": "deepseek-r1-github",
      "title": "DeepSeek-R1 official repository README",
      "origin": "deepseek_github",
      "resource_kind": "code_repository",
      "repository_id": "deepseek-ai/DeepSeek-R1",
      "revision": "0cf78561f1d51c84a21b2190626b21116d5c68bb",
      "path": "README.md",
      "evidence_sha256": "sha256:4ed979e497121ae4dd9f1573da1668219f43be55d62cc0bf2be5429211a67486",
      "canonical_url": "https://github.com/deepseek-ai/DeepSeek-R1/blob/0cf78561f1d51c84a21b2190626b21116d5c68bb/README.md",
      "evidence_url": "https://raw.githubusercontent.com/deepseek-ai/DeepSeek-R1/0cf78561f1d51c84a21b2190626b21116d5c68bb/README.md",
      "candidate_lanes": ["evaluation", "reasoning"],
      "classification_basis": "researcher_inference_from_primary_source",
      "license_review_required": true
    },
    {
      "source_id": "deepseek-r1-hf-model",
      "title": "DeepSeek-R1 official Hugging Face model card",
      "origin": "deepseek_huggingface",
      "resource_kind": "model_repository",
      "repository_id": "deepseek-ai/DeepSeek-R1",
      "revision": "56d4cbbb4d29f4355bab4b9a39ccb717a14ad5ad",
      "path": "README.md",
      "evidence_sha256": "sha256:d26d26ddb518fee60c6c6bf7a708bd751b1619d93a4944f188143693d956c77f",
      "canonical_url": "https://huggingface.co/deepseek-ai/DeepSeek-R1/blob/56d4cbbb4d29f4355bab4b9a39ccb717a14ad5ad/README.md",
      "evidence_url": "https://huggingface.co/deepseek-ai/DeepSeek-R1/resolve/56d4cbbb4d29f4355bab4b9a39ccb717a14ad5ad/README.md",
      "candidate_lanes": ["reasoning", "research_provenance"],
      "classification_basis": "researcher_inference_from_primary_source",
      "license_review_required": true
    },
    {
      "source_id": "deepseek-r1-paper",
      "title": "DeepSeek-R1 primary paper",
      "origin": "arxiv_primary",
      "resource_kind": "paper",
      "repository_id": "2501.12948",
      "revision": "2501.12948v2",
      "path": null,
      "evidence_sha256": "sha256:b191b0a365a64b4ab2791d117069ed17a2933d03554a662ced58b37df52018f4",
      "canonical_url": "https://arxiv.org/abs/2501.12948v2",
      "evidence_url": "https://arxiv.org/pdf/2501.12948v2",
      "candidate_lanes": ["evaluation", "reasoning"],
      "classification_basis": "researcher_inference_from_primary_source",
      "license_review_required": true
    },
    {
      "source_id": "deepseek-v3-2-exp-github",
      "title": "DeepSeek-V3.2-Exp official repository README",
      "origin": "deepseek_github",
      "resource_kind": "code_repository",
      "repository_id": "deepseek-ai/DeepSeek-V3.2-Exp",
      "revision": "87e509a2e5a100d221c97df52c6e8be7835f0057",
      "path": "README.md",
      "evidence_sha256": "sha256:dffcdf358a42599945d49293a4f210dbe589141085207b76c081c9ace1f8fd74",
      "canonical_url": "https://github.com/deepseek-ai/DeepSeek-V3.2-Exp/blob/87e509a2e5a100d221c97df52c6e8be7835f0057/README.md",
      "evidence_url": "https://raw.githubusercontent.com/deepseek-ai/DeepSeek-V3.2-Exp/87e509a2e5a100d221c97df52c6e8be7835f0057/README.md",
      "candidate_lanes": ["long_context", "training_systems"],
      "classification_basis": "researcher_inference_from_primary_source",
      "license_review_required": true
    },
    {
      "source_id": "deepseek-v3-2-exp-hf-model",
      "title": "DeepSeek-V3.2-Exp official Hugging Face model card",
      "origin": "deepseek_huggingface",
      "resource_kind": "model_repository",
      "repository_id": "deepseek-ai/DeepSeek-V3.2-Exp",
      "revision": "194c67e12b1b0d6df0ef373ddcf215bc84027409",
      "path": "README.md",
      "evidence_sha256": "sha256:82ff33612f0f467423a3082dd300e923a94ac14bdec2f44ff22ce0f31ffd1bb4",
      "canonical_url": "https://huggingface.co/deepseek-ai/DeepSeek-V3.2-Exp/blob/194c67e12b1b0d6df0ef373ddcf215bc84027409/README.md",
      "evidence_url": "https://huggingface.co/deepseek-ai/DeepSeek-V3.2-Exp/resolve/194c67e12b1b0d6df0ef373ddcf215bc84027409/README.md",
      "candidate_lanes": ["long_context", "research_provenance"],
      "classification_basis": "researcher_inference_from_primary_source",
      "license_review_required": true
    },
    {
      "source_id": "deepseek-v3-github",
      "title": "DeepSeek-V3 official repository README",
      "origin": "deepseek_github",
      "resource_kind": "code_repository",
      "repository_id": "deepseek-ai/DeepSeek-V3",
      "revision": "9b4e9788e4a3a731f7567338ed15d3ec549ce03b",
      "path": "README.md",
      "evidence_sha256": "sha256:1f766f151bb4d501b18c9d1e229ac25682c68c75893d6d3bc9734e2a60125c0e",
      "canonical_url": "https://github.com/deepseek-ai/DeepSeek-V3/blob/9b4e9788e4a3a731f7567338ed15d3ec549ce03b/README.md",